{
  "schema_version": "1.0",
  "experiment_id": "EXP-001",
  "experiment_version": "0.1.0",
  "declared_status": "EXPLORATORY",
  "inputs_digest": "cb57e46dfe2c923d8f10d740e08b0403b4559d927e563a759ae852078e214fcf",
  "code_version": {
    "git_commit": "cf3542e3fecdeb9570a6ecb1455e3963e12bd626",
    "working_tree_dirty": true
  },
  "dependency_versions": {
    "node": "v22.22.0",
    "python": "Python 3.13.16",
    "thesis2lab": "0.1.0"
  },
  "dataset_checksums": {
    "DS-SYN-BIBLIO": "0afb69917ae50653797b5b2cb67c1d510396e24583e6ed7eee91b84f7c147957"
  },
  "checks": [
    {
      "id": "tech:checksum:DS-SYN-BIBLIO",
      "kind": "technical",
      "description": "Dataset DS-SYN-BIBLIO file checksum equals its record",
      "pass": true,
      "required": true,
      "expected": "0afb69917ae50653797b5b2cb67c1d510396e24583e6ed7eee91b84f7c147957",
      "actual": "0afb69917ae50653797b5b2cb67c1d510396e24583e6ed7eee91b84f7c147957"
    },
    {
      "id": "tech:parse",
      "kind": "technical",
      "description": "CSV parses and matches the declared columns and types",
      "pass": true,
      "required": true
    },
    {
      "id": "tech:rows",
      "kind": "technical",
      "description": "Row count equals the dataset record",
      "pass": true,
      "required": true,
      "expected": 600,
      "actual": 600
    },
    {
      "id": "tech:categories",
      "kind": "technical",
      "description": "Every categorical value belongs to its declared category list",
      "pass": true,
      "required": true,
      "actual": 0
    },
    {
      "id": "tech:run:default",
      "kind": "technical",
      "description": "Runner executes for scenario \"default\"",
      "pass": true,
      "required": true
    },
    {
      "id": "ref:default",
      "kind": "numerical",
      "description": "All records, no filters (vs experiments/EXP-001/tests/reference_impl.py)",
      "pass": true,
      "required": true,
      "reference_kind": "independent_reimplementation",
      "expected": {
        "n_total": 600,
        "n_selected": 600,
        "share_selected": 1,
        "year_min": 2000,
        "year_max": 2024,
        "yearly_trend_slope": 1.38,
        "citations_mean": 11.93,
        "citations_median": 8,
        "n_distinct_country": 4,
        "top_country": "Brazil",
        "n_distinct_theme": 6,
        "top_theme": "service_coverage",
        "n_distinct_method": 5,
        "top_method": "mixed_methods",
        "n_distinct_institution": 5,
        "top_institution": "Synthetic Centre E"
      },
      "actual": {
        "n_total": 600,
        "n_selected": 600,
        "share_selected": 1,
        "year_min": 2000,
        "year_max": 2024,
        "yearly_trend_slope": 1.38,
        "citations_mean": 11.93,
        "citations_median": 8,
        "n_distinct_country": 4,
        "top_country": "Brazil",
        "n_distinct_theme": 6,
        "top_theme": "service_coverage",
        "n_distinct_method": 5,
        "top_method": "mixed_methods",
        "n_distinct_institution": 5,
        "top_institution": "Synthetic Centre E"
      },
      "tolerance": {
        "default": 1e-9
      }
    },
    {
      "id": "rep:default",
      "kind": "repeatability",
      "description": "Two executions of \"default\" give identical output",
      "pass": true,
      "required": true
    },
    {
      "id": "py:default",
      "kind": "numerical",
      "description": "Independent Python implementation agrees on \"default\" (all 16 metrics)",
      "pass": true,
      "required": true,
      "reference_kind": "independent_reimplementation"
    },
    {
      "id": "tech:run:years-2010-2020",
      "kind": "technical",
      "description": "Runner executes for scenario \"years-2010-2020\"",
      "pass": true,
      "required": true
    },
    {
      "id": "ref:years-2010-2020",
      "kind": "numerical",
      "description": "Years 2010 to 2020 (vs experiments/EXP-001/tests/reference_impl.py)",
      "pass": true,
      "required": true,
      "reference_kind": "independent_reimplementation",
      "expected": {
        "n_total": 600,
        "n_selected": 319,
        "share_selected": 0.5316666666666666,
        "year_min": 2010,
        "year_max": 2020,
        "yearly_trend_slope": 1.8272727272727274,
        "citations_mean": 12.106583072100314,
        "citations_median": 8,
        "n_distinct_country": 4,
        "top_country": "Brazil",
        "n_distinct_theme": 6,
        "top_theme": "wastewater_treatment",
        "n_distinct_method": 5,
        "top_method": "mixed_methods",
        "n_distinct_institution": 5,
        "top_institution": "Synthetic University B"
      },
      "actual": {
        "n_total": 600,
        "n_selected": 319,
        "share_selected": 0.5316666666666666,
        "year_min": 2010,
        "year_max": 2020,
        "yearly_trend_slope": 1.8272727272727274,
        "citations_mean": 12.106583072100314,
        "citations_median": 8,
        "n_distinct_country": 4,
        "top_country": "Brazil",
        "n_distinct_theme": 6,
        "top_theme": "wastewater_treatment",
        "n_distinct_method": 5,
        "top_method": "mixed_methods",
        "n_distinct_institution": 5,
        "top_institution": "Synthetic University B"
      },
      "tolerance": {
        "default": 1e-9
      }
    },
    {
      "id": "rep:years-2010-2020",
      "kind": "repeatability",
      "description": "Two executions of \"years-2010-2020\" give identical output",
      "pass": true,
      "required": true
    },
    {
      "id": "py:years-2010-2020",
      "kind": "numerical",
      "description": "Independent Python implementation agrees on \"years-2010-2020\" (all 16 metrics)",
      "pass": true,
      "required": true,
      "reference_kind": "independent_reimplementation"
    },
    {
      "id": "tech:run:brazil",
      "kind": "technical",
      "description": "Runner executes for scenario \"brazil\"",
      "pass": true,
      "required": true
    },
    {
      "id": "ref:brazil",
      "kind": "numerical",
      "description": "Country = Brazil (vs experiments/EXP-001/tests/reference_impl.py)",
      "pass": true,
      "required": true,
      "reference_kind": "independent_reimplementation",
      "expected": {
        "n_total": 600,
        "n_selected": 264,
        "share_selected": 0.44,
        "year_min": 2001,
        "year_max": 2024,
        "yearly_trend_slope": 0.5782608695652174,
        "citations_mean": 11.140151515151516,
        "citations_median": 7,
        "n_distinct_country": 1,
        "top_country": "Brazil",
        "n_distinct_theme": 6,
        "top_theme": "regulation_and_governance",
        "n_distinct_method": 5,
        "top_method": "mixed_methods",
        "n_distinct_institution": 5,
        "top_institution": "Synthetic University A"
      },
      "actual": {
        "n_total": 600,
        "n_selected": 264,
        "share_selected": 0.44,
        "year_min": 2001,
        "year_max": 2024,
        "yearly_trend_slope": 0.5782608695652174,
        "citations_mean": 11.140151515151516,
        "citations_median": 7,
        "n_distinct_country": 1,
        "top_country": "Brazil",
        "n_distinct_theme": 6,
        "top_theme": "regulation_and_governance",
        "n_distinct_method": 5,
        "top_method": "mixed_methods",
        "n_distinct_institution": 5,
        "top_institution": "Synthetic University A"
      },
      "tolerance": {
        "default": 1e-9
      }
    },
    {
      "id": "rep:brazil",
      "kind": "repeatability",
      "description": "Two executions of \"brazil\" give identical output",
      "pass": true,
      "required": true
    },
    {
      "id": "py:brazil",
      "kind": "numerical",
      "description": "Independent Python implementation agrees on \"brazil\" (all 16 metrics)",
      "pass": true,
      "required": true,
      "reference_kind": "independent_reimplementation"
    },
    {
      "id": "tech:run:two-countries-theme",
      "kind": "technical",
      "description": "Runner executes for scenario \"two-countries-theme\"",
      "pass": true,
      "required": true
    },
    {
      "id": "ref:two-countries-theme",
      "kind": "numerical",
      "description": "Brazil or Canada, water quality only (vs experiments/EXP-001/tests/reference_impl.py)",
      "pass": true,
      "required": true,
      "reference_kind": "independent_reimplementation",
      "expected": {
        "n_total": 600,
        "n_selected": 54,
        "share_selected": 0.09,
        "year_min": 2000,
        "year_max": 2023,
        "yearly_trend_slope": 0.07391304347826087,
        "citations_mean": 11.592592592592593,
        "citations_median": 9,
        "n_distinct_country": 2,
        "top_country": "Brazil",
        "n_distinct_theme": 1,
        "top_theme": "water_quality",
        "n_distinct_method": 5,
        "top_method": "mixed_methods",
        "n_distinct_institution": 5,
        "top_institution": "Synthetic University A"
      },
      "actual": {
        "n_total": 600,
        "n_selected": 54,
        "share_selected": 0.09,
        "year_min": 2000,
        "year_max": 2023,
        "yearly_trend_slope": 0.07391304347826087,
        "citations_mean": 11.592592592592593,
        "citations_median": 9,
        "n_distinct_country": 2,
        "top_country": "Brazil",
        "n_distinct_theme": 1,
        "top_theme": "water_quality",
        "n_distinct_method": 5,
        "top_method": "mixed_methods",
        "n_distinct_institution": 5,
        "top_institution": "Synthetic University A"
      },
      "tolerance": {
        "default": 1e-9
      }
    },
    {
      "id": "rep:two-countries-theme",
      "kind": "repeatability",
      "description": "Two executions of \"two-countries-theme\" give identical output",
      "pass": true,
      "required": true
    },
    {
      "id": "py:two-countries-theme",
      "kind": "numerical",